{"children":[],"dependencies":[],"id":"T0371","meta":{"active":true,"convergence":["task identity is unique and immutable"],"created_at":"2026-08-23T16:59:22+08:00","phase":"plan","record":"T0371-0823-evaluate-uplift-potential","scenario_type":"research"},"parent":null,"slug":"0823-evaluate-uplift-potential","states":{"act":null,"archive":null,"check":null,"created":"2026-08-23T16:59:22+08:00","do":null,"plan":"2026-08-23T16:59:22+08:00"},"status":"Pending","title":"评估 mattpocock/skills 机制对本项目的提升潜力"}
