{"children":[],"dependencies":[],"id":"T0413","meta":{"active":true,"convergence":["task identity is unique and immutable"],"created_at":"2026-08-29T23:25:55+08:00","phase":"plan","record":"T0413-0829-ontology-validator-from-nodes","scenario_type":"development"},"parent":"T0412","slug":"0829-ontology-validator-from-nodes","states":{"act":null,"archive":null,"check":null,"created":"2026-08-29T23:25:55+08:00","do":null,"plan":"2026-08-29T23:25:55+08:00"},"status":"Pending","title":"让 ontology-validate.py 运行时读取 ontology-rule-* 节点驱动门禁（消除文档/脚本漂移）"}
