{"children":[],"dependencies":[],"id":"T0317","meta":{"active":true,"convergence":["task identity is unique and immutable"],"created_at":"2026-08-18T16:00:00+08:00","phase":"plan","record":"T0317-0818-unified-server-handshake","scenario_type":"development"},"parent":"T0315","slug":"0818-unified-server-handshake","states":{"act":null,"archive":null,"check":null,"created":"2026-08-18T16:00:00+08:00","do":null,"plan":"2026-08-18T16:00:00+08:00"},"status":"Pending","title":"统一 RPC/rdbcomm 服务端 mTLS 握手入口"}
