{
  "children": [],
  "dependencies": [],
  "id": "T0300",
  "meta": {
    "active": false,
    "convergence": [
      "task identity is unique and immutable"
    ],
    "created_at": "2026-08-18T10:33:10+08:00",
    "phase": "archive",
    "record": "T0300-0818-mysql-version-convert-test",
    "scenario_type": "development",
    "completed_at": "2026-08-18T10:54:34+08:00",
    "verdict": {
      "outcome": "confirmed",
      "reason": "四版本逐版本转换测试全 PASS: rows=1M, 全量逐字段差异=0, 聚合(含 8.0)全一致, AC-1~AC-6 通过; 版本拆分无回归; 页序陷阱已沉淀至 EVIDENCE.md",
      "verdict_id": "t0300-check-2026-08-18",
      "at": "2026-08-18T10:58:30+08:00"
    },
    "disposition": {
      "outcome": "projected",
      "reason": "四版本转换测试全 PASS + 页序陷阱沉淀为可复用知识(T0300 knowledge 文件), 工具脚本留源项目 bench/ 供后续回归复用",
      "at": "2026-08-18T10:59:40+08:00"
    }
  },
  "parent": "T0250",
  "slug": "0818-mysql-version-convert-test",
  "states": {
    "act": "2026-08-18T10:58:42+08:00",
    "archive": "2026-08-18T11:00:24+08:00",
    "check": "2026-08-18T10:54:34+08:00",
    "created": "2026-08-18T10:33:10+08:00",
    "do": "2026-08-18T10:38:51+08:00",
    "plan": "2026-08-18T10:33:10+08:00"
  },
  "status": "Completed",
  "title": "MySQL 四版本每个版本的数据文件转换测试（.ibd→Parquet 逐版本验证）"
}
