{"children":[],"dependencies":[],"id":"T0389","meta":{"active":true,"convergence":["task identity is unique and immutable"],"created_at":"2026-08-26T20:40:00+08:00","phase":"plan","record":"T0389-0826-libobk-rdbconfig-dup-init","scenario_type":"development"},"parent":"T0388","slug":"0826-libobk-rdbconfig-dup-init","states":{"act":null,"archive":null,"check":null,"created":"2026-08-26T20:40:00+08:00","do":null,"plan":"2026-08-26T20:40:00+08:00"},"status":"Pending","title":"修复 libobk rdb config 重复初始化（sbtinit/sbtinit2 多入口重复 init_config）"}
