{
 "id": "T0218",
 "slug": "0808-backup-server-architecture",
 "title": "备份工具与服务端程序架构调研 → 完整备份产品架构设计",
 "parent": null,
 "children": [],
 "status": "InProgress",
 "meta": {
  "phase": "do",
  "active": true,
  "scenario_type": "research",
  "created_at": "2026-08-08T09:30:00+08:00",
  "convergence": [
   "T0218-0808-backup-server-architecture"
  ],
  "record": "T0218-0808-backup-server-architecture"
 },
 "states": {
  "created": "2026-08-08T09:30:00+08:00",
  "plan": "2026-08-08T10:56:59.655726+08:00",
  "do": "2026-08-08T10:56:59.655726+08:00",
  "check": null,
  "act": null,
  "archive": null
 },
 "dependencies": []
}