{"children":[],"dependencies":[],"id":"T0316","meta":{"active":true,"convergence":["task identity is unique and immutable"],"created_at":"2026-08-18T15:50:00+08:00","phase":"plan","record":"T0316-0818-rpc-legacy-helper-cleanup","scenario_type":"development"},"parent":"T0315","slug":"0818-rpc-legacy-helper-cleanup","states":{"act":null,"archive":null,"check":null,"created":"2026-08-18T15:50:00+08:00","do":null,"plan":"2026-08-18T15:50:00+08:00"},"status":"Pending","title":"清理 RPC 遗留辅助函数并移除无效 unused 属性"}
