{
  "children": [],
  "dependencies": [],
  "id": "T3969",
  "meta": {
    "active": true,
    "convergence": [
      "删除 .bak 后构建成功且全量 pytest PASS",
      "删除 legacy pg9 clog 读取器后构建成功且全量 pytest PASS",
      "pg_versions.h 集中 PG18 事实并定义分发注册点；pg_replay.c 经版本边界分派",
      "移除死函数后构建 -Wall -Wextra 0 警告",
      "删除未编译死桩 stub_pg.c 并移除 pgbin 全套, 构建与测试仍绿",
      "单索引与多索引端到端测试全量 PASS(9 passed)"
    ],
    "created_at": "2026-08-26T09:43:33+08:00",
    "phase": "check",
    "record": "T3969-0826-pgwrecover-cleanup-for-multiversion",
    "scenario_type": "development",
    "completed_at": "2026-08-26T10:22:36+08:00"
  },
  "parent": null,
  "slug": "0826-pgwrecover-cleanup-for-multiversion",
  "states": {
    "act": null,
    "archive": null,
    "check": "2026-08-26T10:22:36+08:00",
    "created": "2026-08-26T09:43:33+08:00",
    "do": "2026-08-26T09:48:25+08:00",
    "plan": "2026-08-26T09:43:33+08:00"
  },
  "status": "Completed",
  "title": "pgwrecover 清理多余 PG 代码并为多版本支持建立版本边界"
}
