{"children":[],"dependencies":[],"id":"T0325","meta":{"active":true,"convergence":["task identity is unique and immutable"],"created_at":"2026-08-19T10:28:38+08:00","phase":"plan","record":"T0325-0819-pg-poc-consistency-visibility","scenario_type":"research"},"parent":"T0301","slug":"0819-pg-poc-consistency-visibility","states":{"act":null,"archive":null,"check":null,"created":"2026-08-19T10:28:38+08:00","do":null,"plan":"2026-08-19T10:28:38+08:00"},"status":"Pending","title":"T0308 收尾: 一致性+数据可见性 POC（端到端闭环 + 可见性矩阵）"}
