{
  "children": [],
  "dependencies": [],
  "id": "T0295",
  "meta": {
    "active": false,
    "convergence": [
      "36个提交(v65-v101)逐一分析，每节含修改内容/修改作用/架构变更三要素",
      "v65→v101整体架构演进主线汇总(目录队列→dirty journal→Reactor迁移→observability)",
      "以git diff为事实来源、ROUND文档为背景补充",
      "v91无独立提交的事实说明"
    ],
    "created_at": "2026-08-16T07:53:14+08:00",
    "phase": "archive",
    "record": "T0295-0816-backupstream-git-history",
    "scenario_type": "research",
    "completed_at": "2026-08-16T08:08:39+08:00",
    "verdict": {
      "outcome": "confirmed",
      "reason": "36提交逐一覆盖(AC-1)、三要素齐全(AC-2)、4条演进主线+全景图(AC-3/AC-4)、v91无提交已说明(AC-5)、git diff为事实来源并发现文档-代码漂移(AC-6)；grill修正后重登记v3证据，convergence验证valid:true",
      "verdict_id": "T0295-check-v1",
      "at": "2026-08-16T08:16:01+08:00"
    },
    "disposition": {
      "outcome": "projected",
      "reason": "四类可复用架构模式已沉淀到 knowledge/linux-epoll-eventloop/backupstream-v65-v101-arch-evolution.md，记录报告本身为归档依据",
      "at": "2026-08-16T08:21:30+08:00"
    }
  },
  "parent": null,
  "slug": "0816-backupstream-git-history",
  "states": {
    "act": "2026-08-16T08:19:18+08:00",
    "archive": "2026-08-16T08:21:53+08:00",
    "check": "2026-08-16T08:08:39+08:00",
    "created": "2026-08-16T07:53:14+08:00",
    "do": "2026-08-16T07:54:56+08:00",
    "plan": "2026-08-16T07:53:14+08:00"
  },
  "status": "Completed",
  "title": "学习 backupstream v65-v101 每个提交的修改内容、作用与架构演进"
}
