{
  "id": "T0195",
  "slug": "0802-fsck-cli",
  "title": "fsck 风格 CLI：verify_all 健康检查入口",
  "parent": "T0194",
  "children": [],
  "status": "Completed",
  "meta": {
    "phase": "archive",
    "active": false,
    "scenario_type": "development",
    "created_at": "2026-08-02T11:02:00+08:00",
    "convergence": [
      "T0195-0802-fsck-cli"
    ],
    "record": "T0195-0802-fsck-cli",
    "completed_at": "2026-08-02T11:19:23+08:00",
    "verdict": {
      "verdict_id": "V-T0195-001",
      "outcome": "confirmed",
      "reason": "AC-1..AC-6 全部满足：fsck_image + subvol-fsck 打开持久化引擎运行 verify_all、退出码 0/1/2 分层、仅 no-repair 模式（对齐 fsck.rs:419-447/:266-269）；226 测试全绿（单项<=40s）+ fmt；双轴审查 0 blocking；实现期打开即重建 derived 事实已澄清落实。",
      "at": "2026-08-02T11:20:00+08:00"
    },
    "disposition": {
      "outcome": "projected",
      "reason": "fsck 风格 CLI 健康检查入口模式沉淀为 core/fsck-style-cli-healthcheck.md；verify_all 作为 worker 变体最终一致性检查点、模型守卫决策注入、-f force 修复路径留待后续任务",
      "at": "2026-08-02T11:21:20+08:00"
    }
  },
  "states": {
    "created": "2026-08-02T11:02:00+08:00",
    "plan": "2026-08-02T11:02:00+08:00",
    "do": "2026-08-02T11:03:34+08:00",
    "check": "2026-08-02T11:19:23+08:00",
    "act": "2026-08-02T11:20:22+08:00",
    "archive": "2026-08-02T11:21:12+08:00"
  }
}
