{"children":[],"dependencies":[],"id":"T0396","meta":{"active":true,"convergence":["task identity is unique and immutable"],"created_at":"2026-08-27T05:34:40+08:00","phase":"plan","record":"T0396-0827-registry-param-bounds-policy","scenario_type":"development"},"parent":"T0395","slug":"0827-registry-param-bounds-policy","states":{"act":null,"archive":null,"check":null,"created":"2026-08-27T05:34:40+08:00","do":null,"plan":"2026-08-27T05:34:40+08:00"},"status":"Pending","title":"跟进：rdb config 注册表支持 min/max/maxlen 与 invalid_policy 并下沉工具范围校验"}
