{"children":[],"dependencies":[],"id":"T0315","meta":{"active":true,"convergence":["task identity is unique and immutable"],"created_at":"2026-08-18T15:45:00+08:00","phase":"plan","record":"T0315-0818-rpc-net-protocol-cleanup","scenario_type":"development"},"parent":null,"slug":"0818-rpc-net-protocol-cleanup","states":{"act":null,"archive":null,"check":null,"created":"2026-08-18T15:45:00+08:00","do":null,"plan":"2026-08-18T15:45:00+08:00"},"status":"Pending","title":"清理 rpc-net-protocol 遗留代码"}
