{"children":[],"dependencies":[],"id":"T3981","meta":{"active":true,"convergence":["task identity is unique and immutable"],"created_at":"2026-08-26T17:00:07+08:00","phase":"plan","record":"T3981-0826-fix-int-sec-switch-failopen","scenario_type":"development"},"parent":"T3980","slug":"0826-fix-int-sec-switch-failopen","states":{"act":null,"archive":null,"check":null,"created":"2026-08-26T17:00:07+08:00","do":null,"plan":"2026-08-26T17:00:07+08:00"},"status":"Pending","title":"跟进：rdb-config INT 安全开关 env 脏值 fail-open 整改"}
