{
  "children": [],
  "dependencies": [],
  "id": "T3982",
  "meta": {
    "active": true,
    "convergence": [
      "task identity is unique and immutable"
    ],
    "created_at": "2026-08-26T17:18:57+08:00",
    "phase": "do",
    "record": "T3982-0826-pgwrecover-common-code-extraction",
    "scenario_type": "development"
  },
  "parent": "T3971",
  "slug": "0826-pgwrecover-common-code-extraction",
  "states": {
    "act": null,
    "archive": null,
    "check": null,
    "created": "2026-08-26T17:18:57+08:00",
    "do": "2026-08-26T17:20:30+08:00",
    "plan": "2026-08-26T17:18:57+08:00"
  },
  "status": "InProgress",
  "title": "pgwrecover 公共代码抽取：从 pg16/pg18 提取共享模块到 src/pg/common/"
}
