{"children":[],"dependencies":[],"id":"T0299","meta":{"active":true,"convergence":["task identity is unique and immutable"],"created_at":"2026-08-16T10:03:49+08:00","phase":"plan","record":"T0299-0816-transport-ownership","scenario_type":"research"},"parent":null,"slug":"0816-transport-ownership","states":{"act":null,"archive":null,"check":null,"created":"2026-08-16T10:03:49+08:00","do":null,"plan":"2026-08-16T10:03:49+08:00"},"status":"Pending","title":"backupstream 传输所有权设计分析"}
