{"children":[],"dependencies":[],"id":"T0400","meta":{"active":true,"convergence":["task identity is unique and immutable"],"created_at":"2026-08-29T09:59:55+00:00","phase":"plan","record":"T0400-0829-onto-ssot-schema","scenario_type":"design"},"parent":"T0399","slug":"0829-onto-ssot-schema","states":{"act":null,"archive":null,"check":null,"created":"2026-08-29T09:59:55+00:00","do":null,"plan":"2026-08-29T09:59:55+00:00"},"status":"Pending","title":"定义本体 SSOT 词汇表与 frontmatter schema"}
